<?xml version="1.0" encoding="UTF-8"?>
<tour-package xmlns:xsi="http://www.w3.org/2001/XMLSchema-instance" xsi:noNamespaceSchemaLocation="file:///D:/WebServices/XSD/tour-packages.xsd">
	<package-no>983</package-no>
	<package-name>Sparkling Darjeeling</package-name>
	<days>4</days>
	<nights>5</nights>
	<package-amount>250000</package-amount>
	<place>
		<domestic-place>
			<place-name>tea farms</place-name>
			<type>recreational</type>
			<travel-mode>bus</travel-mode>
			<hours>24</hours>
			<description>scenic beauty</description>
		</domestic-place>
		<domestic-place>
			<place-name>tiger hills</place-name>
			<type>adventure</type>
			<travel-mode>bus</travel-mode>
			<hours>12</hours>
			<description>animal adventures</description>
		</domestic-place>
	</place>
</tour-package>
